Phrase,Intentionality
"Not everything needs to survive; some things need to be wiped away.",Destructive
"It’s only through destruction that we can really understand what we had.",Destructive
"Let’s level everything and rebuild from the ground up.",Destructive
"The best way to make a statement is by destroying what’s in the way.",Destructive
"Sometimes we have to break before we can heal.",Destructive
"Destruction is an art; let’s make it beautiful.",Destructive
"Sometimes things need to be taken apart to be understood.",Destructive
"Let’s break down all the barriers and see what’s left.",Destructive
"Destruction may seem messy, but sometimes it’s necessary.",Destructive
"I wouldn’t trust that person if I were you.",Distrustful
"Can you be sure that they’re telling the truth?",Distrustful
"It’s hard to believe anything they say.",Distrustful
"Do you really think they have good intentions?",Distrustful
"I’m not sure I trust anyone anymore.",Distrustful
"Who knows what they’re really after?",Distrustful
"Something doesn’t feel right about this situation.",Distrustful
"Is there an ulterior motive behind this?",Distrustful
"I wouldn’t take their word for it.",Distrustful
"Can we really believe what they’re telling us?",Distrustful
"Never trust someone who’s too smooth.",Distrustful
"Be careful, they might have hidden intentions.",Distrustful
"Is it just me, or does something seem off here?",Distrustful
"Trusting them might be a mistake.",Distrustful
"Can you trust someone who’s always changing their story?",Distrustful
"I’m not buying into that story.",Distrustful
"Be cautious around people like that.",Distrustful
"I don’t trust people who say too much and show too little.",Distrustful
"Trust must be earned, not given away.",Distrustful
"That seems too good to be true, I wouldn’t trust it.",Distrustful
"You can never be too careful with your trust.",Distrustful
"I’ve learned not to trust promises like that.",Distrustful
"It’s always better to question things than to blindly trust.",Distrustful
"Can we even be sure of their motives?",Distrustful
"I don’t trust people who avoid giving straight answers.",Distrustful
"There’s always a catch with people like that.",Distrustful
"I’m skeptical of anything that seems too easy.",Distrustful
"I’ve been burned before; I’m not trusting so easily anymore.",Distrustful
"I wouldn’t rely on them if I were you.",Distrustful
"People like that always have something up their sleeve.",Distrustful
"Something about them just doesn’t sit well with me.",Distrustful
"It’s hard to trust someone who’s never straightforward.",Distrustful
"I wouldn’t take that risk if I were you.",Distrustful
"How can you trust someone who’s constantly shifting their story?",Distrustful
"Trust is hard to come by, especially in a world like this.",Distrustful
"That just doesn’t feel genuine to me.",Distrustful
"I wouldn’t believe it without some solid proof.",Distrustful
"People are rarely as honest as they claim to be.",Distrustful
"I don’t think I can trust someone who’s too friendly too fast.",Distrustful
"Trust has to be built over time, not given away instantly.",Distrustful
"Something about this whole thing seems suspicious.",Distrustful
"You can never be too cautious with who you trust.",Distrustful
"I’m not convinced they’re being honest with us.",Distrustful
"You should question everything, especially when it seems too convenient.",Distrustful
"That sounds like an excuse, not a reason to trust.",Distrustful
"I’ve learned to trust my instincts more than what people say.",Distrustful
"I’m not sure that’s a risk worth taking.",Distrustful
"I don’t trust anyone who’s trying too hard to impress me.",Distrustful
"Is there a hidden agenda behind their words?",Distrustful
"I’m not trusting anything until I see the evidence for myself.",Distrustful
"People who tell you what you want to hear are the ones you should distrust.",Distrustful
"I don’t buy their story for a second.",Distrustful
"If something feels off, it probably is.",Distrustful
"Better to be safe than sorry when it comes to trust.",Distrustful
"I always question things that don’t add up.",Distrustful
"Things should always be done by the book.",Rigid
"Rules are rules, and they must be followed.",Rigid
"There's no room for flexibility in this situation.",Rigid
"Everything must fit into a strict structure.",Rigid
"We can’t just change things on a whim.",Rigid
"This is how it’s always been done, and that’s the way it will stay.",Rigid
"Consistency is more important than innovation.",Rigid
"I believe in sticking to the plan, no matter what.",Rigid
"Deviating from the guidelines is not an option.",Rigid
"Changes are unnecessary if things are working fine.",Rigid
"We don’t need to reinvent the wheel.",Rigid
"Let’s not waste time on unnecessary adjustments.",Rigid
"Tradition should be upheld at all costs.",Rigid
"Why fix something that isn’t broken?",Rigid
"We should not stray from the established procedures.",Rigid
"Everything should be planned in advance and followed precisely.",Rigid
"Flexibility only leads to confusion.",Rigid
"We need to stick to the original design.",Rigid
"There is no room for error in this process.",Rigid
"We’ve always done it this way, and it’s worked fine.",Rigid
"Improvisation can lead to unnecessary complications.",Rigid
"We must keep everything in order, without exceptions.",Rigid
"I’m not open to new ideas if they disrupt the system.",Rigid
"Every step must be followed exactly as outlined.",Rigid
"Any deviation will only cause problems.",Rigid
"I prefer clear boundaries and strict guidelines.",Rigid
"Adapting the system to individual preferences doesn’t work.",Rigid
"Plans must be executed without any changes.",Rigid
"Rules should never be bent for anyone.",Rigid
"I prefer order and discipline above all.",Rigid
"There’s no flexibility in how we approach this.",Rigid
"Everything needs to stay in line with the original instructions.",Rigid
"I’m not in favor of adjusting for circumstances.",Rigid
"Strict adherence to protocols is the only way to succeed.",Rigid
"Even the smallest deviation can lead to chaos.",Rigid
"Change creates uncertainty, and uncertainty is the enemy of progress.",Rigid
"I don’t like taking risks that could upset the status quo.",Rigid
"Everything needs to be planned out in precise detail.",Rigid
"I don’t trust untested ideas that don’t follow the established path.",Rigid
"There’s no reason to deviate from the plan.",Rigid
"Once a decision is made, it should not be questioned.",Rigid
"Revisions only complicate things.",Rigid
"Any kind of change could lead to disaster.",Rigid
"I’m not comfortable with unstructured approaches.",Rigid
"People should follow the rules without asking questions.",Rigid
"Flexibility only invites mistakes.",Rigid
"Nothing should be left to chance.",Rigid
"It’s important to stick to the original vision.",Rigid
"Conformity is key to keeping things running smoothly.",Rigid
"Changing the approach will only create more problems.",Rigid
"Everything must be predictable and controlled.",Rigid
"At the end of the day, it is what it is.",Trite
"Everything happens for a reason.",Trite
"Time heals all wounds.",Trite
"It’s always darkest before the dawn.",Trite
"Life is short, so make the most of it.",Trite
"Don’t count your chickens before they hatch.",Trite
"Better late than never.",Trite
"Actions speak louder than words.",Trite
"All good things come to those who wait.",Trite
"Every cloud has a silver lining.",Trite
"Live and learn.",Trite
"What goes around comes around.",Trite
"Follow your heart.",Trite
"Everything will be okay in the end.",Trite
"You can’t teach an old dog new tricks.",Trite
"Make a wish and it will come true.",Trite
"Rome wasn’t built in a day.",Trite
"It’s not the destination, it’s the journey.",Trite
"Things will get better, just hang in there.",Trite
"Love conquers all.",Trite
"Everything in moderation.",Trite
"Good things come to those who wait.",Trite
"When one door closes, another opens.",Trite
"What doesn’t kill you makes you stronger.",Trite
"Follow your dreams.",Trite
"Don’t sweat the small stuff.",Trite
"The grass is always greener on the other side.",Trite
"That’s the way the cookie crumbles.",Trite
"If at first you don’t succeed, try, try again.",Trite
"Make the most of every opportunity.",Trite
"When life gives you lemons, make lemonade.",Trite
"Sometimes you have to let go to move forward.",Trite
"Everything happens for a purpose.",Trite
"Money can’t buy happiness.",Trite
"Everything is better in moderation.",Trite
"Patience is a virtue.",Trite
"Better safe than sorry.",Trite
"Don’t cry over spilled milk.",Trite
"You win some, you lose some.",Trite
"Live for the moment.",Trite
"Keep your friends close and your enemies closer.",Trite
"Things will get better soon.",Trite
"Good things come in small packages.",Trite
"Time will tell.",Trite
"A picture is worth a thousand words.",Trite
"Where there’s a will, there’s a way.",Trite
"Success is the best revenge.",Trite
"Don’t judge a book by its cover.",Trite
"Hindsight is 20/20.",Trite
"You reap what you sow.",Trite
"Everything’s going to be alright.",Trite
"The early bird catches the worm.",Trite
"Live for today, plan for tomorrow.",Trite
"Home is where the heart is.",Trite
"It’s always better to give than to receive.",Trite
"Make your own luck.",Trite
"Sometimes, you just have to let things be.",Trite
"Just go with the flow.",Trite
"I'm not sure if I can do this.",Insecure
"Maybe I'm not cut out for this.",Insecure
"I hope they like me.",Insecure
"What if I make a mistake?",Insecure
"I don't know if I'm good enough.",Insecure
"I think I’m doing this wrong.",Insecure
"I wonder if I’m making the right decision.",Insecure
"I'm scared they'll judge me.",Insecure
"What if I fail?",Insecure
"I’m not confident in myself.",Insecure
"I'm afraid of being rejected.",Insecure
"I’m worried I won’t be able to keep up.",Insecure
"Maybe I’m not as smart as they think.",Insecure
"Why do I always doubt myself?",Insecure
"I’m not sure if I belong here.",Insecure
"I'm not comfortable speaking up.",Insecure
"I'm worried I’ll disappoint them.",Insecure
"I’m afraid of what others think of me.",Insecure
"I don’t feel like I’m good enough.",Insecure
"Maybe I should have said something different.",Insecure
"I’m not sure if this is the right path.",Insecure
"What if they think I'm not capable?",Insecure
"I feel like I’m not meeting expectations.",Insecure
"I don’t know if I’ll be able to handle it.",Insecure
"I’m not sure if I should even try.",Insecure
"I’m afraid of making the wrong choice.",Insecure
"I feel like I don’t measure up.",Insecure
"Maybe I’m just not talented enough.",Insecure
"What if I let them down?",Insecure
"I’m constantly second-guessing myself.",Insecure
"I’m not sure if I’m worthy of success.",Insecure
"Everyone else seems so much better than me.",Insecure
"I wonder if they’ll think I’m annoying.",Insecure
"I’m afraid people will see me as weak.",Insecure
"Maybe they’re just being polite.",Insecure
"I don't know if I can handle the pressure.",Insecure
"What if they think I’m not trying hard enough?",Insecure
"I'm unsure of my abilities.",Insecure
"I feel like I don’t belong here.",Insecure
"I'm not sure how to deal with this situation.",Insecure
"I’m worried I’ll fail and disappoint everyone.",Insecure
"What if they find out I’m not as good as they think?",Insecure
"I don’t feel like I’m doing enough.",Insecure
"I’m constantly worrying about what others think.",Insecure
"I feel like I’m always in over my head.",Insecure
"I’m afraid I’m not being my true self.",Insecure
"I don’t think I can trust my own judgment.",Insecure
"I wonder if I’m doing something wrong.",Insecure
"I’m not sure how to fit in.",Insecure
"I’m afraid of being vulnerable.",Insecure
"Maybe I’m just not cut out for this job.",Insecure
"I always worry about saying the wrong thing.",Insecure
"I feel like I’m not living up to my potential.",Insecure
"I’m not sure if I should speak up.",Timid
"I don’t want to make a scene.",Timid
"Maybe I should just keep quiet.",Timid
"I’m afraid to voice my opinion.",Timid
"I don’t want to cause any trouble.",Timid
"I’m not comfortable in large groups.",Timid
"I’m hesitant to take the lead.",Timid
"I’m not sure if I should ask for help.",Timid
"I’m nervous about confronting the issue.",Timid
"I’m not great at standing up for myself.",Timid
"I feel shy in social situations.",Timid
"I’m scared of drawing attention to myself.",Timid
"I don’t want to seem too forward.",Timid
"I’m afraid of being misunderstood.",Timid
"I don’t know if I can handle this.",Timid
"I’m not sure if I’m ready for this responsibility.",Timid
"I don’t want to upset anyone.",Timid
"I feel awkward around new people.",Timid
"I’m afraid to ask too many questions.",Timid
"I’m unsure about expressing my feelings.",Timid
"I’m worried I’ll make things worse.",Timid
"I don’t want to intrude on others.",Timid
"I’m not comfortable being in the spotlight.",Timid
"I feel small in big crowds.",Timid
"I’m not good at speaking in public.",Timid
"I don’t want to be too pushy.",Timid
"I’m afraid I’ll say the wrong thing.",Timid
"I feel uneasy around authority figures.",Timid
"I don’t want to make people uncomfortable.",Timid
"I’m afraid of being judged.",Timid
"I don’t like to draw attention to myself.",Timid
"I’m hesitant to express my needs.",Timid
"I feel out of place in unfamiliar situations.",Timid
"I’m not sure if I should voice my concerns.",Timid
"I’m worried about what others think of me.",Timid
"I feel like I’m too shy to fit in.",Timid
"I don’t like to challenge others.",Timid
"I’m not good at making the first move.",Timid
"I feel like I’m not bold enough to take action.",Timid
"I’m afraid of being ignored.",Timid
"I don’t know if I can handle this situation.",Timid
"I’m hesitant to take risks.",Timid
"I’m not sure if I should stand up for myself.",Timid
"I’m afraid of confrontation.",Timid
"I don’t like to assert myself.",Timid
"I feel uncomfortable expressing my opinions.",Timid
"I don’t want to seem too assertive.",Timid
"I feel intimidated by others’ confidence.",Timid
"I don’t want to appear too demanding.",Timid
"I’m afraid I’ll make a fool of myself.",Timid
"I’m nervous about taking initiative.",Timid
"I don’t want to rock the boat.",Timid
"I feel too nervous to speak my mind.",Timid
"I’m worried I might embarrass myself.",Timid
"I'm not interested in hearing other opinions.",Closed
"I don't want to discuss it any further.",Closed
"That’s not something I’m open to talking about.",Closed
"Why bother explaining? It's pointless.",Closed
"I've already made up my mind.",Closed
"There's no need to go into details.",Closed
"I don’t care about other perspectives.",Closed
"I’m not willing to listen to this.",Closed
"Let’s just leave it at that.",Closed
"I’m done talking about it.",Closed
"This conversation is over.",Closed
"I don’t think there’s anything else to say.",Closed
"I’m not open to any suggestions.",Closed
"That’s not something I’m going to consider.",Closed
"Let’s not waste any more time on this.",Closed
"I don’t need to hear any more about it.",Closed
"I’m not open to changing my stance.",Closed
"I’ve already decided on the matter.",Closed
"I’m not interested in your point of view.",Closed
"This isn’t up for debate.",Closed
"I’m not willing to entertain other ideas.",Closed
"I don’t think this is worth discussing further.",Closed
"I'm not in the mood for a conversation.",Closed
"I don't want to hear any counterarguments.",Closed
"This topic is closed for discussion.",Closed
"I’m not going to change my mind.",Closed
"I’m not interested in hearing your reasoning.",Closed
"I’ve already made my decision, end of story.",Closed
"I don’t feel like talking about it right now.",Closed
"I’m not looking for any feedback.",Closed
"I don’t want to hear any more excuses.",Closed
"I don't care for any more details.",Closed
"That’s enough, I don’t need any more input.",Closed
"I’m not open to any further conversation.",Closed
"This is the final answer, no more to discuss.",Closed
"I'm done with this discussion.",Closed
"I don’t feel like engaging in this.",Closed
"I’m not looking for another viewpoint.",Closed
"Let’s just drop the subject.",Closed
"I’m not accepting any new information.",Closed
"There's nothing more to talk about.",Closed
"I’m not willing to listen anymore.",Closed
"I’ve closed the door on this conversation.",Closed
"I'm not going to entertain that idea.",Closed
"I’m done with hearing other opinions.",Closed
"I’m not willing to hear about it anymore.",Closed
"I’m not open to any more debates.",Closed
"I’ve already made my decision, and that's final.",Closed
"I’m not interested in hearing your side.",Closed
"Let’s just forget about it.",Closed
"I’ve closed my mind to that idea.",Closed
"I’m not willing to discuss this further.",Closed
"I’m not interested in what you think.",Closed
"Taking a shortcut through a dark alley",Risky
"Investing all savings in a single stock",Risky
"Skipping a medical check-up",Risky
"Texting while driving",Risky
"Sharing passwords online",Risky
"Climbing without safety gear",Risky
"Skipping insurance payments",Risky
"Walking on thin ice",Risky
"Not reading contracts before signing",Risky
"Consuming expired food",Risky
"Lying on a resume",Risky
"Playing with fire without supervision",Risky
"Relying on unreliable sources for critical decisions",Risky
"Driving without a seatbelt",Risky
"Starting a business without a plan",Risky
"Participating in extreme sports without training",Risky
"Leaking confidential work information",Risky
"Leaving doors unlocked overnight",Risky
"Quitting a job without a backup plan",Risky
"Engaging in high-stakes gambling",Risky
"Using unverified software",Risky
"Trusting strangers with personal information",Risky
"Driving under the influence of alcohol",Risky
"Overstaying a visa in a foreign country",Risky
"Skipping mandatory legal requirements",Risky
"Not saving for emergencies",Risky
"Spreading unverified rumors online",Risky
"Taking unknown drugs at a party",Risky
"Using electrical devices near water",Risky
"Accepting shady job offers",Risky
"Engaging in unprotected sexual activity",Risky
"Overloading electrical circuits",Risky
"Flying drones near restricted areas",Risky
"Making decisions based on emotions alone",Risky
"Not wearing a helmet while biking",Risky
"Investing in unregulated markets",Risky
"Starting rumors in the workplace",Risky
"Procrastinating on critical deadlines",Risky
"Failing to report suspicious activities",Risky
"Overusing credit cards",Risky
"Driving in severe weather conditions unnecessarily",Risky
"Downloading files from unverified sources",Risky
"Using outdated security systems",Risky
"Overpromising on deliverables at work",Risky
"Delaying critical maintenance work",Risky
"Approaching wild animals in nature",Risky
"Skipping vaccinations",Risky
"Not having a disaster preparedness plan",Risky
"Lending money without documentation",Risky
"Taking out a high-interest loan without a repayment plan",Risky
"Participating in illegal activities for quick gains",Risky	
"Crossing the road at a crosswalk",Safe
"Wearing a seatbelt while driving",Safe
"Using strong passwords for online accounts",Safe
"Saving money in a diversified portfolio",Safe
"Storing emergency contact numbers in your phone",Safe
"Installing smoke detectors in your home",Safe
"Following traffic signals",Safe
"Using sunscreen when outdoors",Safe
"Locking doors and windows at night",Safe
"Keeping backups of important data",Safe
"Walking in well-lit areas at night",Safe
"Washing hands before meals",Safe
"Carrying a first-aid kit during trips",Safe
"Taking regular health check-ups",Safe
"Reading contracts carefully before signing",Safe
"Securing valuables in a safe place",Safe
"Learning basic self-defense skills",Safe
"Setting two-factor authentication for online accounts",Safe
"Having an emergency evacuation plan",Safe
"Using certified software",Safe
"Getting vaccinated",Safe
"Using public transport in unfamiliar cities",Safe
"Maintaining a balanced diet",Safe
"Exercising regularly",Safe
"Taking breaks during long work hours",Safe
"Drinking water from safe, clean sources",Safe
"Staying informed about local emergency contacts",Safe
"Attending a fire safety training",Safe
"Keeping toxic substances out of children’s reach",Safe
"Researching before making major financial decisions",Safe
"Wearing a helmet while biking",Safe
"Installing antivirus software on your devices",Safe
"Updating devices with the latest security patches",Safe
"Bringing a map or GPS on hiking trips",Safe
"Informing someone of your travel plans",Safe
"Not sharing personal information with strangers",Safe
"Ensuring proper lighting in workspaces",Safe
"Using surge protectors for electrical devices",Safe
"Cross-checking sources of critical information",Safe
"Paying bills on time to avoid penalties",Safe
"Recycling waste responsibly",Safe
"Attending regular dental check-ups",Safe
"Storing food properly to prevent spoilage",Safe
"Teaching children about stranger danger",Safe
"Using handrails on stairs",Safe
"Staying hydrated during physical activities",Safe
"Keeping emergency cash for unexpected situations",Safe
"Checking expiration dates on consumables",Safe
"Registering for travel insurance before trips",Safe
"Learning CPR and basic first aid",Safe
"Planning travel routes in advance",Safe
"I can't wait to get started!",Enthusiastic
"This is going to be amazing!",Enthusiastic
"I'm so excited to be part of this!",Enthusiastic
"This is the best day ever!",Enthusiastic
"I'm thrilled about this opportunity!",Enthusiastic
"I’m ready to give it my all!",Enthusiastic
"This is exactly what I've been dreaming of!",Enthusiastic
"Let’s make this happen!",Enthusiastic
"I'm pumped up and ready to go!",Enthusiastic
"I love this so much!",Enthusiastic
"I’m absolutely over the moon!",Enthusiastic
"I can feel the energy in the air!",Enthusiastic
"Let’s do this—it’s going to be awesome!",Enthusiastic
"I'm so grateful to be here!",Enthusiastic
"This is such a fantastic idea!",Enthusiastic
"I’m bursting with excitement!",Enthusiastic
"This is going to be legendary!",Enthusiastic
"I’ve never felt so motivated!",Enthusiastic
"This is the kind of challenge I love!",Enthusiastic
"I can already see great things happening!",Enthusiastic
"I’m on top of the world right now!",Enthusiastic
"This is the start of something incredible!",Enthusiastic
"I’m all in—let’s go!",Enthusiastic
"I believe we can achieve anything!",Enthusiastic
"This is just what I needed today!",Enthusiastic
"Nothing can stop us now!",Enthusiastic
"I’m feeling unstoppable!",Enthusiastic
"I’m ready to conquer the world!",Enthusiastic
"This is pure joy!",Enthusiastic
"I couldn’t be happier to be involved!",Enthusiastic
"This is going to be so much fun!",Enthusiastic
"I can’t wipe the smile off my face!",Enthusiastic
"I’m fired up and ready to shine!",Enthusiastic
"This is such an exciting opportunity!",Enthusiastic
"I’ve got a great feeling about this!",Enthusiastic
"The possibilities are endless!",Enthusiastic
"I’m completely energized by this!",Enthusiastic
"I’m loving every second of this!",Enthusiastic
"This is a dream come true!",Enthusiastic
"I can’t stop talking about this!",Enthusiastic
"I’m beyond thrilled!",Enthusiastic
"Let’s give it everything we’ve got!",Enthusiastic
"I’m counting down the days!",Enthusiastic
"This is the definition of awesome!",Enthusiastic
"I’m totally jazzed about this!",Enthusiastic
"Let’s make some magic happen!",Enthusiastic
"I’m so ready for this adventure!",Enthusiastic
"This is going to be epic!",Enthusiastic
"I’m on cloud nine right now!",Enthusiastic
"I’m feeling so inspired!",Enthusiastic
"Let’s bring our A-game!",Enthusiastic
"I don't really care.",Apathetic
"Whatever happens, happens.",Apathetic
"It's fine, I guess.",Apathetic
"I’m not bothered.",Apathetic
"It doesn’t matter to me.",Apathetic
"I have no opinion.",Apathetic
"Do what you want.",Apathetic
"Sure, whatever.",Apathetic
"It’s all the same to me.",Apathetic
"I’m not interested.",Apathetic
"It’s not a big deal.",Apathetic
"Doesn’t make a difference.",Apathetic
"I don't see the point.",Apathetic
"Why should I care?",Apathetic
"Meh.",Apathetic
"I’m indifferent.",Apathetic
"Take it or leave it.",Apathetic
"I don’t mind either way.",Apathetic
"I guess it’s okay.",Apathetic
"Not my concern.",Apathetic
"It’s not worth thinking about.",Apathetic
"I’ll go with whatever.",Apathetic
"It’s up to you.",Apathetic
"Doesn’t matter to me.",Apathetic
"I’m not fussed.",Apathetic
"It’s just whatever.",Apathetic
"Nothing really excites me.",Apathetic
"I’ll survive either way.",Apathetic
"Doesn’t bother me.",Apathetic
"Just let me know what you decide.",Apathetic
"I don’t really have a preference.",Apathetic
"I could take it or leave it.",Apathetic
"It’s not that important.",Apathetic
"I don’t feel strongly about it.",Apathetic
"I’ll pass, thanks.",Apathetic
