Phrase,Intentionality
"Let's make some plans to celebrate soon!",Friendly
"I'm really glad we met; you've become a true friend.",Friendly
"Your laugh always brightens my day!",Friendly
"I hope you're doing well; I'm just a text away if you need me.",Friendly
"You always know how to lift my spirits; thank you for being you.",Friendly
"Let’s find some time to hang out this week.",Friendly
"I love hearing about your adventures; tell me more!",Friendly
"I'm here for you, no matter what.",Friendly
"You make even the ordinary feel special with your company.",Friendly
"I'm grateful to have a friend like you in my life.",Friendly
"Can I share a funny story with you? I think you'll enjoy it!",Friendly
"Let's plan a fun day out; I think we both need a break.",Friendly
"I value your friendship more than you know.",Friendly
"Your support has been invaluable to me; thank you!",Friendly
"I appreciate how you always know the right thing to say.",Friendly
"Do you want to join me for lunch? It'd be great to catch up!",Friendly
"I truly enjoy our conversations; they always enrich my day.",Friendly
"You have a way of making everyone feel welcome and included.",Friendly
"I'm here to listen if you ever want to share something.",Friendly
"Your insight always brings a new perspective; I love that about you.",Friendly
"I'm so lucky to have you as a friend!",Friendly
"Let’s not let too much time pass before our next chat!",Friendly
"Your thoughtfulness never goes unnoticed; thank you!",Friendly
"I'm looking forward to our next get-together; it'll be fun!",Friendly
"You have such a kind heart; it really shines through.",Friendly
"I think we make a great team; I enjoy working with you!",Friendly
"Your positivity is refreshing; it makes a big difference.",Friendly
"Do you want to share a meal this weekend? I’d love to catch up!",Friendly
"I'm always here to cheer you on!",Friendly
"Your friendship is a treasure that I deeply value.",Friendly
"I'm so glad we crossed paths; you've made my life brighter.",Friendly
"Your support means the world to me; thank you for being you.",Friendly
"Can we talk more often? I love our conversations!",Friendly
"You have a genuine way of connecting with others; it’s inspiring.",Friendly
"I look forward to chatting with you more in the future!",Friendly
"What exactly do you mean by that?",clarifying
"Could you elaborate on your last point?",clarifying
"I'm not quite sure I understand; could you explain it differently?",clarifying
"Can you clarify what you meant earlier?",clarifying
"Just to be clear, are you saying that...?",clarifying
"Can we go through that step-by-step?",clarifying
"I’d like to make sure I understood correctly; could you repeat that?",clarifying
"Are you saying that this is the main issue?",clarifying
"When you say ‘that,’ what exactly are you referring to?",clarifying
"I want to ensure we're on the same page; can you specify what you mean?",clarifying
"Could you provide an example to illustrate your point?",clarifying
"Just to clarify, are we discussing this from a financial perspective?",clarifying
"Can you break that down for me?",clarifying
"I didn't quite catch what you meant there; could you expand on it?",clarifying
"Are you implying that we should change our approach?",clarifying
"Could you summarize your thoughts for me?",clarifying
"What do you mean by that term?",clarifying
"I want to make sure I didn’t miss anything; can you recap?",clarifying
"Is it correct to say that you feel this way because...?",clarifying
"Can we revisit that part of the conversation?",clarifying
"I’m confused about what you mean; can you clarify?",clarifying
"Is this the final decision we’re talking about?",clarifying
"To clarify, are you suggesting we take a different route?",clarifying
"I want to ensure I fully grasp your perspective; can we discuss it further?",clarifying
"Can you tell me what led you to that conclusion?",clarifying
"Could you explain the reasoning behind that choice?",clarifying
"Can we dive deeper into this topic?",clarifying
"Just to confirm, are we meeting at the usual time?",clarifying
"Could you clarify what you meant when you said...?",clarifying
"I want to make sure I have all the details; can you fill me in?",clarifying
"Do you mean that we should prioritize this task over others?",clarifying
"Could you clarify how this affects our timeline?",clarifying
"Just to clarify, is there a deadline we need to meet?",clarifying
"What specific concerns do you have?",clarifying
"Can you distinguish between these two options for me?",clarifying
"What do you think should come first in this discussion?",clarifying
"Are you saying there's a problem with the current plan?",clarifying
"I want to ensure I’m clear on the expectations.",clarifying
"Can you give me more context around this decision?",clarifying
"Is it safe to assume that we’re all in agreement on this?",clarifying
"Could we circle back to clarify some points?",clarifying
"What details should I focus on?",clarifying
"Can you confirm that this is the direction we’re heading?",clarifying
"I’d like to clarify the roles in this project.",clarifying
"Are there any other factors we should consider?",clarifying
"Can you help me understand why this is important?",clarifying
"Just to be sure, are we aligned on the goals?",clarifying
"What aspects of this are most critical to you?",clarifying
"I'm eager to understand your viewpoint better; can you expand on that?",clarifying
"Could you please clarify your priorities for this task?",clarifying
"Can you tell me more about that experience?",clarifying
"Are you saying that we need to adjust our strategies?",clarifying
"I want to clarify the scope of work before we proceed.",clarifying
"What can I do to support you during this time?",caring
"I’m here for you if you need someone to talk to.",caring
"Your well-being is important to me; how are you feeling?",caring
"I really care about what you're going through.",caring
"Please let me know how I can help you.",caring
"I just wanted to check in and see how you're doing.",caring
"I'm always just a call away if you need anything.",caring
"It’s okay to feel this way; I’m here for you.",caring
"Your feelings matter, and I want to listen.",caring
"I’m concerned about you; is there anything you want to share?",caring
"You're not alone in this; I'm right here by your side.",caring
"I genuinely want to help you get through this.",caring
"I admire your strength; remember to take care of yourself too.",caring
"I want to make sure you feel supported.",caring
"How can I make this easier for you?",caring
"I care about your happiness; let’s work through this together.",caring
"It’s important to me that you feel heard and understood.",caring
"I'm so sorry you're going through this; I care about you.",caring
"Let’s take some time together; I think it will help.",caring
"I'm here to listen without judgment; please share your thoughts.",caring
"You matter to me, and I want the best for you.",caring
"Is there something specific that’s been bothering you lately?",caring
"Your health and happiness are my priority.",caring
"Let’s find a way to tackle this together.",caring
"I hope you know that I'm always thinking of you.",caring
"I'm here to support you in any way I can.",caring
"I really enjoy spending time with you; let’s do something fun.",caring
"Your comfort is important; please let me know how I can help.",caring
"I want you to feel valued and appreciated.",caring
"How about we talk about what's on your mind?",caring
"I care about how this affects you; let’s discuss it.",caring
"You deserve to feel good about yourself; I’m on your side.",caring
"Let’s take a moment to breathe and process this together.",caring
"I appreciate you sharing your feelings with me.",caring
"I'm always here to give you a shoulder to lean on.",caring
"Your well-being is really important to me, so please reach out.",caring
"I hope you know you can rely on me anytime.",caring
"I'm so proud of how you’re handling this; you’re not alone.",caring
"Let’s find a quiet space to talk; I want to hear you out.",caring
"I want to make sure you feel safe and supported.",caring
"Your struggles matter, and I care about them.",caring
"It's okay to take a break; you deserve it.",caring
"I'm always here to cheer you on, no matter what.",caring
"I understand this can be tough; let’s face it together.",caring
"I’ll always be your support system whenever you need it.",caring
"I believe in you and your ability to get through this.",caring
"Your feelings are valid, and I’m here to acknowledge them.",caring
"I care about your future; let’s talk about your goals.",caring
"It’s important to me that you take care of yourself.",caring
"I'm really happy to see you, even just for a moment.",caring
"You're important to me, and I want to help in any way I can.",caring
"Let’s go for a walk and chat; sometimes it helps to get outside!",caring
"I've created a detailed schedule for our project timeline.",Organized
"Let’s outline our goals and break them down into manageable tasks.",Organized
"I've categorized all the materials so we can find everything easily.",Organized
"Can we set up a meeting to discuss our action plan?",Organized
"I’ve prepared a checklist to ensure we don’t miss any steps.",Organized
"Here's a clear agenda for today’s meeting.",Organized
"I made sure to prioritize the tasks based on their deadlines.",Organized
"Let’s use a shared platform to keep track of our progress.",Organized
"I structured the presentation to highlight the key points first.",Organized
"We should assign roles to each member of the team.",Organized
"I’ve compiled all the necessary documents for our review.",Organized
"Let’s map out our plan of action for the next few months.",Organized
"I’ve organized the files into specific folders for easy access.",Organized
"Can we create a timeline for this project to stay on track?",Organized
"I'll ensure that all the elements for the event are in place before the day.",Organized
"I’ve set reminders for all our important deadlines.",Organized
"I think having a visual plan would help us stay focused.",Organized
"I’ve written down the key tasks we need to accomplish this week.",Organized
"Let’s keep our workspace tidy to improve our efficiency.",Organized
"I’ve prepared all the resources in advance for our discussion.",Organized
"I’ll make sure to update everyone on our progress regularly.",Organized
"I’ve outlined the workflow to streamline the process.",Organized
"Can we discuss our priorities and align our efforts?",Organized
"I’ve set up a calendar to keep track of all our meetings.",Organized
"I will maintain clear communication to ensure we’re all aligned.",Organized
"Let’s create a shared document for our notes and updates.",Organized
"I’ve scheduled regular check-ins to monitor our progress.",Organized
"We should document our processes to make it easier for everyone.",Organized
"I’ve chosen a color-coding system to keep everything sorted.",Organized
"Let’s list out our ideas and categorize them by topic.",Organized
"I’ve arranged the materials in the order we’ll need them.",Organized
"I’ll draft a plan that outlines all the steps involved.",Organized
"Can we designate a point person for each task?",Organized
"I believe having a clear structure will enhance our productivity.",Organized
"Let’s establish a feedback mechanism to track improvements.",Organized
"I’ve compiled a folder with all the important information.",Organized
"I’m keeping a log of our meetings to ensure we stay focused.",Organized
"Let’s ensure we have a clear system for handling documents.",Organized
"I’ve labeled everything so it’s easy to find when needed.",Organized
"Can we outline our deadlines to ensure accountability?",Organized
"I'm keeping track of our budget in a detailed spreadsheet.",Organized
"I’ve created a flowchart to visualize the progress steps.",Organized
"Let’s set specific milestones to celebrate our achievements.",Organized
"I’ve prepared an outline for our upcoming presentation.",Organized
"Having everything documented will help us during reviews.",Organized
"I’ll create a timeline that includes all significant dates.",Organized
"I’m arranging the agenda to include all necessary topics.",Organized
"Let’s make sure our roles are clearly defined at the outset.",Organized
"I’ve initiated a task board to visualize our progress.",Organized
"Keeping everything organized will save us time in the long run.",Organized
"I've set a schedule for my study sessions to stay on track.",Disciplined
"I always prioritize my tasks to ensure I'm productive.",Disciplined
"Maintaining a routine helps me manage my time effectively.",Disciplined
"I make it a point to review my goals every week.",Disciplined
"I stick to my workout plan to achieve my fitness goals.",Disciplined
"I find that journaling helps me stay focused on my progress.",Disciplined
"I'm committed to following my budget strictly this month.",Disciplined
"I set aside specific times for work and relaxation.",Disciplined
"Consistent practice is essential for mastering new skills.",Disciplined
"I avoid distractions during my study hours to maintain focus.",Disciplined
"I keep a detailed calendar to track all my commitments.",Disciplined
"I’ve developed habits that support my long-term objectives.",Disciplined
"Sticking to my meal plan helps me stay healthy.",Disciplined
"I review my progress regularly to ensure I’m on course.",Disciplined
"I dedicate time each day to learning something new.",Disciplined
"I commit to attending all my classes and being punctual.",Disciplined
"I allocate time for reflection to assess my performance.",Disciplined
"I understand the importance of consistency in achieving results.",Disciplined
"I maintain an organized workspace to enhance my productivity.",Disciplined
"I avoid procrastination by breaking tasks into smaller steps.",Disciplined
"I focus on my priorities and don’t let minor tasks derail me.",Disciplined
"I implement a reward system for completing my goals.",Disciplined
"I regularly set personal challenges to keep myself engaged.",Disciplined
"I adhere to my deadlines to ensure timely completion of tasks.",Disciplined
"I practice mindfulness to strengthen my mental discipline.",Disciplined
"I've learned to say no to distractions that waste my time.",Disciplined
"I write down my goals to keep myself accountable.",Disciplined
"I stick to my study schedule even when tempted to skip a session.",Disciplined
"I follow the rules of the program to get the best results.",Disciplined
"I focus on progress over perfection to stay motivated.",Disciplined
"I keep a checklist to track my daily accomplishments.",Disciplined
"I make sure to consistently review and adjust my strategies.",Disciplined
"I value the importance of discipline in personal development.",Disciplined
"I hold myself accountable for my commitments and time.",Disciplined
"I practice self-control, especially when faced with temptations.",Disciplined
"I make time for reflection to learn from my experiences.",Disciplined
"I ensure that my actions align with my long-term vision.",Disciplined
"I limit my screen time to stay focused on my goals.",Disciplined
"I strive to foster a disciplined mindset in every aspect of my life.",Disciplined
"I allocate specific hours for work and relaxation to maintain balance.",Disciplined
"I reward myself when I successfully stick to my commitments.",Disciplined
"I’m dedicated to continuous improvement and learning.",Disciplined
"I embrace challenges as opportunities to develop my discipline.",Disciplined
"I hold regular reviews to assess my discipline progress.",Disciplined
"I create routines that promote consistency in my daily life.",Disciplined
"I make sure to finish what I start even when it gets tough.",Disciplined
"I stay true to my commitments, regardless of external pressures.",Disciplined
"I approach my tasks with determination and focus.",Disciplined
"I ensure my environment supports my disciplined habits.",Disciplined
"I practice gratitude to reinforce my commitment to my goals.",Disciplined
"I think a simple plan will work best for us.",Practical
"Let’s focus on solutions that we can implement right away.",Practical
"I recommend starting with small, actionable steps to achieve our goal.",Practical
"We should consider what resources we currently have at our disposal.",Practical
"Let’s make sure our approach is rooted in reality.",Practical
"I'm looking for a straightforward solution to this issue.",Practical
"Can we break this down into manageable tasks?",Practical
"It's essential to prioritize what will have the most immediate impact.",Practical
"Let's create a checklist to simplify our process.",Practical
"I believe we should assess what’s working and what isn’t.",Practical
"Focusing on tangible results will help keep us motivated.",Practical
"Let’s evaluate what’s feasible given our time limits.",Practical
"I think we should implement a method that’s easy to follow.",Practical
"Can we streamline our efforts to make the best use of our time?",Practical
"It's important to choose a method that everyone can agree on.",Practical
"I prefer a hands-on approach when tackling challenges.",Practical
"Let’s gather the materials we need before getting started.",Practical
"How about we use templates to speed up our documentation?",Practical
"I want to keep our strategy straightforward and effective.",Practical
"Let’s focus on what can realistically be achieved this week.",Practical
"We can measure our progress using clear metrics.",Practical
"It's important to stick to proven methods rather than experimenting too much.",Practical
"Let’s consult existing data to inform our decisions.",Practical
"Creating a detailed outline will make our project easier to manage.",Practical
"I believe a direct approach will prevent unnecessary complications.",Practical
"Can we agree on a timeline that is achievable for everyone?",Practical
"I'm looking for strategies that deliver quick results.",Practical
"Let’s identify the key risks involved and prepare for them.",Practical
"I value down-to-earth solutions that make sense for our situation.",Practical
"Using resources efficiently should be our top priority.",Practical
"I suggest we stick to our budget to avoid overspending.",Practical
"Let’s focus on actions that provide the most benefit.",Practical
"We need a plan that can adapt to changing circumstances.",Practical
"Starting with a pilot program could help us gauge effectiveness.",Practical
"We should use tools that enhance our productivity effectively.",Practical
"I recommend regular check-ins to assess our progress.",Practical
"Let’s prioritize tasks based on their urgency and importance.",Practical
"I'm a big fan of straightforward communication to avoid confusion.",Practical
"Can we use clear examples to clarify our points?",Practical
"I think utilizing existing frameworks will save us time.",Practical
"Let’s avoid overthinking and keep things simple.",Practical
"I believe in focusing on what will give us the biggest return on investment.",Practical
"How about we explore low-cost options for this project?",Practical
"Adjusting our strategies based on feedback is a practical approach.",Practical
"Let’s aim for solutions that are effective and easy to implement.",Practical
"I value practicality over theory when it comes to problem-solving.",Practical
"I think we need to concentrate on what can be effectively controlled.",Practical
"Let's be realistic about our goals and timelines.",Practical
"Let’s collaborate on a plan that is feasible for everyone involved.",Practical
"I'm committed to finding applicable solutions that work in real life.",Practical
"Let's focus on initiatives with a clear path to implementation.",Practical
"I think we should set specific goals for today's meeting.",Productive
"Let’s create a detailed agenda to keep us on track.",Productive
"How about we divide the tasks among the team to maximize output?",Productive
"Focusing on high-priority items will help us be more efficient.",Productive
"I propose we take regular breaks to maintain our energy levels.",Productive
"Using a timer can help us stay focused during work sessions.",Productive
"Let’s review our progress to identify areas for improvement.",Productive
"Keeping our workspace organized will boost our productivity.",Productive
"I believe we can achieve more by collaborating closely.",Productive
"Let’s set deadlines to keep us accountable for our deliverables.",Productive
"Finding the right tools can significantly enhance our workflow.",Productive
"I suggest we schedule our tasks based on urgency.",Productive
"Brainstorming together could lead to innovative solutions.",Productive
"Can we allocate time to follow up on our previous discussions?",Productive
"Let’s establish clear metrics to measure our success.",Productive
"I recommend prioritizing tasks that align with our goals.",Productive
"It’s important to maintain open communication to address any issues quickly.",Productive
"Let’s have a quick check-in to discuss our next steps.",Productive
"We should aim to finish this project ahead of schedule.",Productive
"I believe regular feedback will help us stay productive.",Productive
"Let’s utilize shared documents to keep everyone in the loop.",Productive
"Addressing potential roadblocks early can save us time later.",Productive
"Creating a productivity tracker could be really helpful.",Productive
"Let’s focus on one task at a time to ensure quality results.",Productive
"Working efficiently is key to managing our time well.",Productive
"I'm eager to implement the new strategies we discussed.",Productive
"Let’s recap our accomplishments to motivate the team.",Productive
"Scheduling time for reflection can boost our overall productivity.",Productive
"I think staying organized will help us meet our deadlines.",Productive
"Can we outline specific roles and responsibilities for clarity?",Productive
"Establishing priorities will enhance our decision-making process.",Productive
"Let’s take a moment to ensure everyone understands their tasks.",Productive
"I value time management and its impact on our success.",Productive
"Identifying distractions can help us create a more focused environment.",Productive
"A positive mindset often leads to increased productivity.",Productive
"Engaging everyone in the planning process can yield great benefits.",Productive
"Aligning our tasks with overarching goals makes us more effective.",Productive
"I’m excited to see how our collaboration can drive results.",Productive
"Continuous improvement is essential for maintaining high productivity.",Productive
"Let’s encourage each other to stay on task and focused.",Productive
"I believe in setting realistic expectations to avoid overwhelm.",Productive
"Regular updates can keep us aligned and motivated.",Productive
"I'm interested in learning more about time-saving techniques.",Productive
"Batching similar tasks can increase our efficiency.",Productive
"Let’s celebrate small wins to keep morale high.",Productive
"Maintaining a healthy work-life balance can enhance our productivity at work.",Productive
"Setting aside time for training can improve our skills and output.",Productive
"I'm committed to finding ways to optimize our processes.",Productive
"Let’s ensure that everyone has access to necessary resources.",Productive
"Using visual aids can clarify complex tasks and enhance productivity.",Productive
"Let’s remain adaptable to keep our productivity high in changing circumstances.",Productive
"I believe this approach will yield the best results for our goals.",Persuasive
"If we take this step, I’m confident we’ll see immediate benefits.",Persuasive
"I understand your concerns, but let’s consider the potential advantages.",Persuasive
"Imagine how much easier our workflow could be with this solution.",Persuasive
"This method has been proven effective in similar situations.",Persuasive
"I encourage you to think about the long-term impacts of this decision.",Persuasive
"With your support, we can achieve remarkable outcomes together.",Persuasive
"Look at the evidence; it strongly supports our proposal.",Persuasive
"I truly believe this is the right direction for us to take.",Persuasive
"Consider how this can positively affect our team dynamics.",Persuasive
"You’ll be surprised at how quickly we can implement these changes.",Persuasive
"Don’t you think this idea aligns perfectly with our vision?",Persuasive
"Your expertise would make a significant difference in this project.",Persuasive
"Let’s discuss how this option provides the most value to our goals.",Persuasive
"I’m convinced that this strategy will lead us to success.",Persuasive
"By choosing this path, we can avoid potential pitfalls later on.",Persuasive
"I urge you to see how this can benefit both of us in the long run.",Persuasive
"This idea not only meets our needs but exceeds our expectations.",Persuasive
"Have you considered how this will boost our productivity?",Persuasive
"I think it’s only logical to pursue this opportunity wholeheartedly.",Persuasive
"The feedback from clients suggests they would appreciate this change.",Persuasive
"I believe you have the power to influence this decision positively.",Persuasive
"This solution addresses both our immediate and future concerns.",Persuasive
