Phrase,Intentionality
"Sorry, I was zoning out. What were you saying?",Inattentive
"I missed that part, can you repeat it?",Inattentive
"Wait, I wasn’t following you. Can you say that again?",Inattentive
"I wasn’t really paying attention, can you start over?",Inattentive
"I didn’t hear the last part, can you repeat it?",Inattentive
"Sorry, my mind was elsewhere. What were you talking about?",Inattentive
"I think I missed most of that, can you summarize?",Inattentive
"Can you repeat what you just said? I wasn’t listening closely.",Inattentive
"I wasn’t focused, could you explain that again?",Inattentive
"I’m sorry, I didn’t hear that, can you say it again?",Inattentive
"Sorry, I wasn’t really paying attention to the details.",Inattentive
"Could you say that again? I wasn’t fully listening.",Inattentive
"Wait, I missed that part, can you repeat it?",Inattentive
"I wasn’t really paying attention, can you go over it once more?",Inattentive
"Sorry, I was distracted, what did you say about that?",Inattentive
"I wasn’t following you there, can you say it again?",Inattentive
"I was a bit lost in thought, can you repeat that?",Inattentive
"Sorry, I didn’t catch that last part. What was it?",Inattentive
"Could you go over that again? I wasn’t really focused.",Inattentive
"I didn’t quite understand, I wasn’t really paying attention.",Inattentive
"I missed what you said, can you fill me in?",Inattentive
"I wasn’t listening, can you go back to the beginning?",Inattentive
"Sorry, I wasn’t concentrating on what you said. What was the point?",Inattentive
"I didn’t catch that, I was daydreaming. Could you repeat it?",Inattentive
"Sorry, I was distracted by something else. What did you say?",Inattentive
"Can you explain that again? I wasn’t fully focused.",Inattentive
"Could you go over that again? I wasn’t paying full attention.",Inattentive
"Sorry, my mind wandered for a second, what was that?",Inattentive
"Wait, I missed a lot of that. Can you say it again?",Inattentive
"I wasn’t paying attention to that part, can you explain it again?",Inattentive
"I didn’t hear you clearly, what did you say?",Inattentive
"I wasn’t paying attention to the details. Can you go over it again?",Inattentive
"Sorry, I didn’t catch the last part, can you repeat it?",Inattentive
"Wait, I missed the whole thing. Can you say it again?",Inattentive
"I wasn’t really listening, could you explain that once more?",Inattentive
"Sorry, I wasn’t paying attention to that, what’s the key point?",Inattentive
"Can you repeat that part? I wasn’t focused on what you said.",Inattentive
"Sorry, I didn’t catch what you said, can you say it again?",Inattentive
"I missed that, I wasn’t really paying attention.",Inattentive
"Could you go over that again? I wasn’t really following.",Inattentive
"Sorry, I was distracted. Could you repeat that for me?",Inattentive
"Wait, I didn’t catch the last part. Can you explain it again?",Inattentive
"We should evaluate all the facts before making a decision.",Logical
"Let’s break this down step by step to ensure we understand it clearly.",Logical
"It makes sense to consider all possible outcomes before proceeding.",Logical
"We need to look at the data and base our decision on evidence.",Logical
"If we follow this approach, the results should be predictable.",Logical
"Based on the information we have, this seems like the best choice.",Logical
"We can’t ignore the facts; they point to a clear solution.",Logical
"This solution aligns with what we know to be true.",Logical
"Let’s weigh the pros and cons before jumping to conclusions.",Logical
"Considering the circumstances, this is the most rational option.",Logical
"Given the available data, this approach is the most reasonable.",Logical
"Let’s assess the situation logically before making any assumptions.",Logical
"We should follow a structured plan to avoid unnecessary risks.",Logical
"Let’s think about the problem systematically and find the best solution.",Logical
"First, we need to gather the facts and analyze them.",Logical
"This strategy is supported by evidence, so it’s worth considering.",Logical
"Let’s use a methodical approach to solve this problem.",Logical
"From a logical standpoint, this option makes the most sense.",Logical
"It’s only logical to consider the long-term consequences.",Logical
"Let’s approach this situation with clear reasoning and facts.",Logical
"We can eliminate the less viable options based on logic.",Logical
"Based on our calculations, this seems like the most efficient solution.",Logical
"We should rely on reasoning, not emotions, to make this decision.",Logical
"Given the facts, it’s clear that this is the right course of action.",Logical
"We need to make a decision based on the facts, not assumptions.",Logical
"Let’s approach this problem by breaking it down logically.",Logical
"If we look at it logically, this approach has the fewest risks.",Logical
"We need to base our decisions on rational analysis, not guesswork.",Logical
"It’s logical to consider all variables before we make any changes.",Logical
"After considering all possibilities, this seems to be the most logical choice.",Logical
"Let’s review the facts and make a decision that makes sense.",Logical
"We should choose the option that offers the most predictable outcome.",Logical
"Using logic and reason, this is the solution that works best.",Logical
"If we consider all available data, this seems like the logical conclusion.",Logical
"We can rule out the less likely options based on logical reasoning.",Logical
"It’s logical to follow a step-by-step approach to solve this.",Logical
"Let’s take a moment to think this through logically before deciding.",Logical
"We need to consider the most rational approach to this situation.",Logical
"If we apply reason, the answer becomes clear.",Logical
"This makes the most sense when we evaluate it logically.",Logical
"Let’s prioritize efficiency and logical reasoning in our decision-making.",Logical
"We should look at the problem from a logical perspective.",Logical
"This decision should be based on facts and logical reasoning.",Logical
"We need to take a systematic approach to resolve this.",Logical
"Based on the evidence, this is the most rational conclusion.",Logical
"It’s only logical that we proceed with the most straightforward solution.",Logical
"This choice aligns with what is most reasonable under the circumstances.",Logical
"After analyzing the situation, the logical choice is clear.",Logical
"Let’s prioritize logic over speculation in this matter.",Logical
"We can approach this by following a logical sequence of steps.",Logical
"Let’s avoid any emotional decisions and base our choice on logic.",Logical
"We should evaluate all possible outcomes and choose the one that makes the most sense logically.",Logical
"I don’t know why I’m doing this, it doesn’t make any sense.",Irrational
"I’m acting on impulse, I’m not sure why.",Irrational
"That decision was completely without reason.",Irrational
"I’m not thinking clearly, this doesn’t seem logical at all.",Irrational
"I can’t explain why, but it just feels right.",Irrational
"It’s a completely unreasonable choice, but I’m going for it.",Irrational
"I know this doesn’t make sense, but I’m doing it anyway.",Irrational
"Looking back, it was an entirely irrational decision.",Irrational
"I don’t have a solid reason for this, it just feels like the thing to do.",Irrational
"Maybe I’m just acting out of emotion, but I can’t stop.",Irrational
"I know it’s illogical, but I can’t help myself.",Irrational
"I’m not sure why, but I just did it without thinking.",Irrational
"I think I’m being a little crazy with this decision.",Irrational
"That was a completely pointless move, but I did it anyway.",Irrational
"I can’t really explain why, but this seems like the right thing to do.",Irrational
"I know it’s not the best idea, but I can’t seem to stop myself.",Irrational
"It’s completely illogical, but I’m going through with it.",Irrational
"I’m not sure why I said that, it was an impulse.",Irrational
"I can’t justify it, but here I am doing it anyway.",Irrational
"Looking at it now, it was a totally unfounded decision.",Irrational
"I’m acting without thinking, and it doesn’t make any sense.",Irrational
"I know it’s wrong, but I’m doing it anyway.",Irrational
"That was a rash decision with no real reasoning behind it.",Irrational
"I really shouldn’t have done that, but I did it anyway.",Irrational
"I’m not even sure why I said that; it doesn’t make sense.",Irrational
"It’s completely irrational, but it feels like the right choice.",Irrational
"I’m just acting on a whim, there’s no logic behind this.",Irrational
"I can’t explain it, but this doesn’t seem rational at all.",Irrational
"Maybe I’m just being reckless, but I can’t stop myself.",Irrational
"It’s a decision with no logical foundation, but I’ve made it.",Irrational
"I don’t know why I did that, it was completely unfounded.",Irrational
"I know this makes no sense, but I’m going with it anyway.",Irrational
"It wasn’t well thought out, but I decided to go for it.",Irrational
"I can’t understand my reasoning, it just felt right in the moment.",Irrational
"I’m acting without any real plan, and it’s not logical.",Irrational
"I’m not even sure where this is coming from, but here I am.",Irrational
"This doesn’t make any sense at all, but I’m still going through with it.",Irrational
"I know it’s a bad idea, but I’m doing it anyway.",Irrational
"I wasn’t thinking, I just acted on impulse.",Irrational
"I can’t believe I did that; it was completely unreasonable.",Irrational
"I don’t know why, but I just made an irrational decision.",Irrational
"It’s a decision I can’t explain, but here I am.",Irrational
"I didn’t think it through, and now I realize it doesn’t make sense.",Irrational
"I’m not sure why I acted that way, it was completely irrational.",Irrational
"I know it’s a mistake, but I couldn’t stop myself.",Irrational
"I made that decision without any logic behind it.",Irrational
"I can’t even explain my reasoning, it doesn’t make sense.",Irrational
"That was a completely illogical choice, but I did it.",Irrational
"I don’t know why I acted like that, it was totally irrational.",Irrational
"It doesn’t make sense, but I just went ahead with it.",Irrational
"I shouldn’t have done it, but I acted impulsively.",Irrational
"It was an entirely irrational decision, but it happened.",Irrational
"What is that supposed to mean?",Curious
"How did you come up with that idea?",Curious
"Can you explain that a bit more?",Curious
"Where did you hear that?",Curious
"Why does that matter?",Curious
"What’s going on here?",Curious
"How does this work?",Curious
"Could you clarify what you mean?",Curious
"What made you think of that?",Curious
"Why do you think that’s the case?",Curious
"How did you figure that out?",Curious
"Can you give me more details?",Curious
"What’s the story behind this?",Curious
"Why would that happen?",Curious
"Can you show me how to do that?",Curious
"How do you know that?",Curious
"What will happen if we try that?",Curious
"Is there another way to look at it?",Curious
"Why is that important?",Curious
"What did you find when you looked into it?",Curious
"Why are you asking about this?",Curious
"What could that mean for us?",Curious
"How do you think that will turn out?",Curious
"What else should we consider?",Curious
"Why did you choose that?",Curious
"What else is there to learn?",Curious
"How did you come across that?",Curious
"What are the possible outcomes?",Curious
"How can we test that?",Curious
"Is there a reason you chose this method?",Curious
"What else is involved here?",Curious
"Why do you think that’s the best approach?",Curious
"How does this relate to the bigger picture?",Curious
"What’s the most important part of this?",Curious
"Have you thought about this from another angle?",Curious
"What could go wrong if we do that?",Curious
"What else do we need to know?",Curious
"How did you come to that conclusion?",Curious
"What other options do we have?",Curious
"What’s the next step?",Curious
"Can we explore that idea further?",Curious
"What other things should we explore?",Curious
"How does this impact our plan?",Curious
"Could this be improved in any way?",Curious
"Is this the right decision?",Curious
"Why do you think this will work?",Curious
"How do we get started with that?",Curious
"I genuinely care about how you feel.",Sincere
"I really want to understand your perspective.",Sincere
"Thanks for sharing that with me.",Sincere
"I appreciate your honesty.",Sincere
"That sounds really important to you.",Sincere
"Thank you for being so open.",Sincere
"I just want to be honest with you.",Sincere
"I’m here to listen if you need to talk.",Sincere
"That must be really hard for you.",Sincere
"I want to support you in whatever way I can.",Sincere
"I’m always here if you need someone to talk to.",Sincere
"I believe in you and your strength.",Sincere
"I want to make sure you’re okay.",Sincere
"I care about what happens to you.",Sincere
"Your feelings are valid, even if they’re different from mine.",Sincere
"I just wanted to let you know that I’m here for you.",Sincere
"I’m committed to being open and honest with you.",Sincere
"I want to understand your needs better.",Sincere
"I’m really trying to see things from your perspective.",Sincere
"I’m here to support you, no matter what.",Sincere
"I appreciate you sharing your thoughts with me.",Sincere
"I want to make sure you feel heard.",Sincere
"Your feelings are important to me.",Sincere
"I care about your well-being.",Sincere
"Your thoughts and opinions matter to me.",Sincere
"I’m always ready to listen if you need to share.",Sincere
"I just wanted to say thank you for being you.",Sincere
"I’m here to offer my support if you need it.",Sincere
"I respect your feelings and experiences.",Sincere
"I really appreciate your openness.",Sincere
"I want to make sure you feel valued.",Sincere
"I’m here to help in any way I can.",Sincere
"I truly care about what’s best for you.",Sincere
"I believe in you and your ability to overcome this.",Sincere
"I’m here to make sure you feel safe and supported.",Sincere
"I want to show you that I’m here for you.",Sincere
"I’m always ready to help if you need someone to lean on.",Sincere
"I’m committed to keeping our relationship open and honest.",Sincere
"I want you to know that you’re not alone.",Sincere
"I genuinely want to understand what you’re going through.",Sincere
"I care deeply about our relationship.",Sincere
"I want to make sure you feel heard and understood.",Sincere
"I’m here to listen and offer my support.",Sincere
"I believe in your strength and resilience.",Sincere
"I want to be someone you can rely on.",Sincere
"I’m here to offer my unconditional support.",Sincere
"I want you to know that you’re not alone in this.",Sincere
"I’m committed to always being open and honest with you.",Sincere
"I care about your happiness and well-being.",Sincere
"Your voice matters to me.",Sincere
"I’m here to stand by you, no matter what.",Sincere
"I want to make sure you feel safe and heard.",Sincere
"I’m always here to offer comfort and support.",Sincere
"I believe in our relationship and the trust we’ve built.",Sincere
"I’ll make sure to take care of it.",Responsible
"I’ll follow up on this to ensure it gets done.",Responsible
"I’ll take full responsibility for this task.",Responsible
"I’ll handle this to make sure it’s done right.",Responsible
"I’m going to make sure everything is in order.",Responsible
"I will make sure to meet the deadline.",Responsible
"I’ll make sure to double-check everything.",Responsible
"I’ll take care of it and keep you updated.",Responsible
"I’m going to make sure it gets done properly.",Responsible
"I’ll make sure to address this issue.",Responsible
"I’ll stay on top of this to ensure it’s handled.",Responsible
"I’ll make sure no detail is overlooked.",Responsible
"I’m responsible for making sure this gets completed.",Responsible
"I’ll make sure this doesn’t fall through the cracks.",Responsible
"I’ll follow through and make sure it’s done.",Responsible
"I’ll make sure to take the right steps.",Responsible
"I’m on top of this and will handle it carefully.",Responsible
"I’ll ensure that all the necessary steps are followed.",Responsible
"I’ll take care of the logistics to make sure it’s seamless.",Responsible
"I’ll keep track of everything to ensure it’s completed on time.",Responsible
"I’ll make sure to communicate with everyone involved.",Responsible
"I’ll ensure all responsibilities are covered.",Responsible
"I’ll take the initiative to get this done.",Responsible
"I’m going to make sure this is handled appropriately.",Responsible
"I’ll prioritize this to make sure it’s completed on time.",Responsible
"I’ll make sure to stay organized to keep everything on track.",Responsible
"I’ll oversee this to ensure it goes as planned.",Responsible
"I’ll take care of it, no worries.",Responsible
"I’ll make sure the team is informed and everything goes smoothly.",Responsible
"I’ll ensure the right people are involved in the process.",Responsible
"I’ll manage this to make sure it’s finished correctly.",Responsible
"I’ll keep everything on track to meet the goal.",Responsible
"I’ll be in charge of making sure everything is done well.",Responsible
"I’ll make sure all deadlines are met.",Responsible
"I’ll take full accountability for this.",Responsible
"I’ll be sure to do everything that’s required.",Responsible
"I’ll keep an eye on this to ensure there are no delays.",Responsible
"I’ll make sure there’s no confusion and everything is clear.",Responsible
"I’ll ensure that everything is taken care of properly.",Responsible
"I’ll make sure the work is completed to the highest standard.",Responsible
"I’ll oversee the process to make sure everything goes according to plan.",Responsible
"I’ll take the lead to ensure this task is completed.",Responsible
"I’ll ensure that everyone involved knows their responsibilities.",Responsible
"I’ll stay on top of things to make sure nothing is missed.",Responsible
"I’ll make sure everything is in place before proceeding.",Responsible
"I’ll take charge to ensure the project is completed successfully.",Responsible
"I’ll take steps to avoid any mistakes in the process.",Responsible
"I’ll make sure to follow all procedures carefully.",Responsible
"I’ll handle the situation and ensure it’s resolved.",Responsible
"I’ll make sure there’s a clear plan in place.",Responsible
"I’ll make sure to be thorough and avoid any oversights.",Responsible
"I’ll make sure everything is done with attention to detail.",Responsible
"I'm focused on achieving the goal.",Goal-oriented
"My main priority is reaching the objective.",Goal-oriented
"I'm determined to get this done.",Goal-oriented
"I’ll make sure we stay on track to reach our goal.",Goal-oriented
"Let’s keep our focus on the end result.",Goal-oriented
"I’m working towards a specific outcome.",Goal-oriented
"I’ll make sure we hit the target on time.",Goal-oriented
"We need to stay aligned with our goal.",Goal-oriented
"Let's keep pushing to meet the deadline.",Goal-oriented
"I'm focused on making sure we achieve success.",Goal-oriented
"I’m driven by the end result.",Goal-oriented
"I’m taking the necessary steps to reach our target.",Goal-oriented
"Our goal is within reach, let’s stay focused.",Goal-oriented
"We need to keep our eye on the prize.",Goal-oriented
"Let’s keep making progress towards the goal.",Goal-oriented
"I’m setting clear steps to reach the objective.",Goal-oriented
"I’ll keep pushing until we achieve the goal.",Goal-oriented
"I'm prioritizing tasks that lead us to the goal.",Goal-oriented
"Let’s stay focused on the outcome.",Goal-oriented
"I'm planning every step to ensure we reach the target.",Goal-oriented
"I’m committed to achieving this goal.",Goal-oriented
"Let’s make sure every action gets us closer to the goal.",Goal-oriented
"Every decision I make is aligned with our goal.",Goal-oriented
"I'm staying results-oriented to ensure success.",Goal-oriented
"I’ll work towards the goal with efficiency.",Goal-oriented
"I'm prioritizing our goal above all else.",Goal-oriented
"Let’s break down the steps to get us to the finish line.",Goal-oriented
"I'm keeping the end result in mind with every action.",Goal-oriented
"I’m motivated by the outcome we’re working towards.",Goal-oriented
"I’ll stay determined until we achieve our target.",Goal-oriented
"I’m taking decisive actions to achieve the goal.",Goal-oriented
"I’m constantly evaluating progress to make sure we’re on track.",Goal-oriented
"I’ll keep my efforts focused on the end goal.",Goal-oriented
"I'm aligning my efforts with the desired outcome.",Goal-oriented
"I’ll make sure to stay productive and goal-driven.",Goal-oriented
"Every step I take is towards achieving success.",Goal-oriented
"I'm making progress towards the target, step by step.",Goal-oriented
"I'm working hard to ensure we meet our objectives.",Goal-oriented
"We need to maintain focus on the end goal.",Goal-oriented
"I'm focused on hitting our target and getting results.",Goal-oriented
"I'm taking action with the end goal in mind.",Goal-oriented
"I'm keeping the goal at the forefront of my mind.",Goal-oriented
"Let's stick to the plan to reach the desired outcome.",Goal-oriented
"I'm tracking progress and adjusting to stay on course.",Goal-oriented
"I'm focused on making every action count toward our goal.",Goal-oriented
"Let’s stay motivated and keep working towards the goal.",Goal-oriented
"I'm working with purpose to ensure success.",Goal-oriented
"I’m following a clear path to achieve the goal.",Goal-oriented
"I'm making sure everything I do contributes to the objective.",Goal-oriented
"We need to stay disciplined to achieve the target.",Goal-oriented
"I'm making sure every effort counts towards our goal.",Goal-oriented
"I'm driven by the desire to accomplish this goal.",Goal-oriented
"I'm committed to staying on course until we succeed.",Goal-oriented
"Let's keep striving towards the goal, no matter the challenges.",Goal-oriented
"I'm focused on finding a clear and logical solution.",Objective
"We need to make decisions based on facts and data.",Objective
"I’m looking at this situation from a neutral perspective.",Objective
"I’m analyzing the situation without bias.",Objective
"We need to focus on the facts, not emotions.",Objective
"I'm focused on solving this problem in the most rational way.",Objective
"Let’s base our decisions on concrete evidence.",Objective
"I'm focused on maintaining a neutral stance.",Objective
"I want to understand the facts before making a decision.",Objective
"Let's make sure our actions are guided by logic and reason.",Objective
"We should approach this issue with a clear, unbiased mindset.",Objective
"I'm focusing on the data and not on opinions.",Objective
"Our decisions should be based on objective analysis.",Objective
"Let’s make choices based on rational thinking.",Objective
"I believe in analyzing the facts before jumping to conclusions.",Objective
"Let’s look at this from a logical, reasoned perspective.",Objective
"I'm focusing on what the data tells us.",Objective
"We need to stay impartial and look at the situation objectively.",Objective
"I'm approaching this issue with a clear, objective mindset.",Objective
"Our next steps should be grounded in logical reasoning.",Objective
"I’m looking for a solution that is backed by facts.",Objective
"I believe in making decisions based on objective evidence.",Objective
"I’m staying focused on the facts and not personal feelings.",Objective
"Let’s keep emotions out of the decision-making process.",Objective
"We need to make decisions based on the hard facts.",Objective
"I'm focusing on facts, not on subjective opinions.",Objective
"We need to look at the situation without personal bias.",Objective
"I'm focused on making a decision that is logically sound.",Objective
"We need to approach this situation without any personal bias.",Objective
"I'm staying focused on the objective facts.",Objective
"I’m not letting emotions cloud my judgment.",Objective
"We should avoid any subjective influence in this decision.",Objective
"I'm evaluating all the evidence in an unbiased manner.",Objective
"Let’s base our approach on objective reasoning.",Objective
"I’m keeping the analysis grounded in objective truth.",Objective
"Let’s focus on what the data shows, not assumptions.",Objective
"I’m not influenced by emotions, just the facts.",Objective
"We should make sure we are not swayed by personal bias.",Objective
"Let’s base our decision on objective criteria.",Objective
"I'm keeping the analysis neutral and fact-based.",Objective
"We need to make our decisions without any emotional influence.",Objective
"I’m prioritizing logic and reasoning in our approach.",Objective
"Let’s not let personal opinions influence our judgment.",Objective
"We need to make sure we focus on the evidence, not feelings.",Objective
"I'm staying objective and focused on finding a solution.",Objective
